<?xml version="1.0" encoding="utf-8"?>
<!DOCTYPE module SYSTEM "api.dtd">

<module name="pygame2.sdlmixer.channel">
  <short>SDL_mixer sound channel handling</short>
  <desc></desc>

  <func name="allocate">
    <call></call>
    <desc></desc>
  </func>
  <func name="expire">
    <call></call>
    <desc></desc>
  </func>
  <func name="fade_out">
    <call></call>
    <desc></desc>
  </func>
  <func name="get_volume">
    <call></call>
    <desc></desc>
  </func>
  <func name="halt">
    <call></call>
    <desc></desc>
  </func>
  <func name="opened">
    <call></call>
    <desc></desc>
  </func>
  <func name="pause">
    <call></call>
    <desc></desc>
  </func>
  <func name="paused">
    <call></call>
    <desc></desc>
  </func>
  <func name="playing">
    <call></call>
    <desc></desc>
  </func>
  <func name="resume">
    <call></call>
    <desc></desc>
  </func>
  <func name="set_volume">
    <call></call>
    <desc></desc>
  </func>
</module>

