<?xml version="1.0" encoding="utf-8"?>
<!DOCTYPE module SYSTEM "api.dtd">

<module name="pygame2.sdlmixer.music">
  <short>SDL_mixer music playback</short>
  <desc></desc>

  <func name="fade_out">
    <call></call>
    <desc></desc>
  </func>
  <func name="fading">
    <call></call>
    <desc></desc>
  </func>
  <func name="get_volume">
    <call></call>
    <desc></desc>
  </func>
  <func name="halt">
    <call></call>
    <desc></desc>
  </func>
  <func name="pause">
    <call></call>
    <desc></desc>
  </func>
  <func name="paused">
    <call></call>
    <desc></desc>
  </func>
  <func name="playing">
    <call></call>
    <desc></desc>
  </func>
  <func name="resume">
    <call></call>
    <desc></desc>
  </func>
  <func name="rewind">
    <call></call>
    <desc></desc>
  </func>
  <func name="set_position">
    <call></call>
    <desc></desc>
  </func>
  <func name="set_volume">
    <call></call>
    <desc></desc>
  </func>
</module>

